{
  "name": "dark",
  "background": {
    "page": "#071018",
    "field": "#0b1b27",
    "glowA": "rgba(19, 170, 196, 0.18)",
    "glowB": "rgba(75, 111, 154, 0.16)"
  },
  "surface": {
    "panel": "rgba(12, 28, 40, 0.92)",
    "panelStrong": "rgba(16, 39, 55, 0.96)",
    "card": "rgba(23, 51, 69, 0.74)",
    "rail": "rgba(7, 18, 28, 0.96)",
    "railHeader": "rgba(16, 45, 64, 0.82)"
  },
  "text": {
    "strong": "#ecf8ff",
    "normal": "#c9d9e5",
    "muted": "#88a2b3",
    "inverse": "#061019"
  },
  "border": {
    "subtle": "rgba(154, 205, 224, 0.16)",
    "strong": "rgba(154, 205, 224, 0.34)",
    "focus": "rgba(83, 214, 238, 0.72)"
  },
  "primary": {
    "base": "#36b8d4",
    "strong": "#65d9ef",
    "soft": "rgba(54, 184, 212, 0.16)"
  },
  "secondary": {
    "base": "#5f7892",
    "soft": "rgba(95, 120, 146, 0.18)"
  },
  "dynamic": {
    "base": "#f2aa3f",
    "strong": "#ffc86b",
    "soft": "rgba(242, 170, 63, 0.18)"
  },
  "warning": {
    "base": "#f07d35",
    "soft": "rgba(240, 125, 53, 0.18)"
  },
  "error": {
    "base": "#ef5350",
    "soft": "rgba(239, 83, 80, 0.18)"
  },
  "success": {
    "base": "#35c98f",
    "soft": "rgba(53, 201, 143, 0.16)"
  },
  "mission": {
    "current": "#f2aa3f",
    "demand": "#b86dff",
    "finalDemand": "#56a8ff"
  },
  "hud": {
    "frame": "rgba(101, 217, 239, 0.72)",
    "horizonSky": "#194e72",
    "horizonGround": "#604b32",
    "marker": "#ffc86b"
  },
  "chart": {
    "grid": "rgba(154, 205, 224, 0.13)",
    "axis": "rgba(201, 217, 229, 0.74)",
    "zero": "rgba(236, 248, 255, 0.5)",
    "modeBand": "rgba(54, 184, 212, 0.08)",
    "modeLine": "rgba(242, 170, 63, 0.5)"
  }
}
